title,abbreviation,scope,field,direction,city,country,publisher,start_date,end_date,submission_deadline,ccf_rating,core_rating,prestige,is_scopus,source_url,source_id
ACM SIGGRAPH Annual Conference,ACM SIGGRAPH,international,Kompyuter fanlari,Computer Graphics & Multimedia,Los Angeles,AQSh,ACM,2026-07-19,2026-07-23,2026-01-22,A,A*,Eng nufuzli,true,https://s2026.siggraph.org/,manual:intl:2026:acm-siggraph
ACM Knowledge Discovery and Data Mining,SIGKDD,international,Kompyuter fanlari,Database & Data Mining,Jeju,Janubiy Koreya,ACM,2026-08-09,2026-08-13,2025-07-31,A,A*,Eng nufuzli,true,https://kdd2026.kdd.org/,manual:intl:2026:sigkdd
USENIX Security Symposium,USENIX Security,international,Kompyuter fanlari,Information Security,Baltimore,AQSh,USENIX,2026-08-12,2026-08-14,2025-08-26,A,A*,Eng nufuzli,true,https://www.usenix.org/conference/usenixsecurity26,manual:intl:2026:usenix-security
ACM Symposium on Operating Systems Principles,SOSP,international,Kompyuter fanlari,Software Engineering,Prague,Chexiya,ACM,2026-09-29,2026-10-02,2026-04-01,A,A*,Eng nufuzli,true,https://sigops.org/s/conferences/sosp/2026/index.html,manual:intl:2026:sosp
ACM Annual International Conference On Mobile Computing And Networking,MobiCom,international,Kompyuter fanlari,Computer Networks,Austin,AQSh,ACM,2026-11-01,2026-11-01,2025-09-03,A,A*,Eng nufuzli,true,https://sigmobile.org/mobicom/2026/,manual:intl:2026:mobicom
ACM Symposium on User Interface Software and Technology,UIST,international,Kompyuter fanlari,Human-Computer Interaction,GM Renaissance Center,AQSh,ACM,2026-11-02,2026-11-05,2026-03-31,A,A*,Eng nufuzli,true,https://uist.acm.org/2026/,manual:intl:2026:uist
ACM International Conference on Multimedia,ACM MM,international,Kompyuter fanlari,Computer Graphics & Multimedia,Rio de Janeiro,Braziliya,ACM,2026-11-10,2026-11-14,2026-04-01,A,A*,Eng nufuzli,true,https://2026.acmmm.org/,manual:intl:2026:acm-mm
ACM Conference on Computer and Communications Security,CCS,international,Kompyuter fanlari,Information Security,World Forum,Niderlandiya,ACM,2026-11-15,2026-11-19,2026-01-14,A,A*,Eng nufuzli,true,https://www.sigsac.org/ccs/CCS2026/,manual:intl:2026:ccs
The IEEE Real-Time Systems Symposium,RTSS,international,Kompyuter fanlari,Interdisciplinary & Mixed,Yokohama,Yaponiya,IEEE,2026-12-09,2026-12-11,2026-05-21,A,A*,Eng nufuzli,true,http://2026.rtss.org/,manual:intl:2026:rtss
IEEE Symposium on Logic in Computer Science,LICS,international,Kompyuter fanlari,Computer Architecture & High Performance Computing,Lisbon,Portugaliya,IEEE,2026-07-20,2026-07-23,2026-01-22,A,A*,Eng nufuzli,true,https://lics.siglog.org/lics26/,manual:intl:2026:lics
ACM SIGSOFT International Symposium on Software Testing and Analysis,ISSTA,international,Kompyuter fanlari,Software Engineering,Oakland,AQSh,ACM,2026-10-03,2026-10-09,2026-01-29,A,A*,Eng nufuzli,true,https://conf.researchr.org/home/issta-2026,manual:intl:2026:issta
ACM Conference on Computer Supported Cooperative Work and Social Computing,CSCW,international,Kompyuter fanlari,Human-Computer Interaction,Salt Lake City,AQSh,ACM,2026-10-10,2026-10-14,2025-05-13,A,A*,Eng nufuzli,true,https://cscw.acm.org/2026/,manual:intl:2026:cscw
IEEE/ACM International Symposium on Microarchitecture,MICRO,international,Kompyuter fanlari,Computer Science Theory,Athens,Greciya,IEEE,2026-10-31,2026-11-04,2026-04-07,A,A*,Eng nufuzli,true,https://microarch.org/micro59/,manual:intl:2026:micro
IEEE Visualization Conference,IEEE VIS,international,Kompyuter fanlari,Computer Graphics & Multimedia,Boston,AQSh,IEEE,2026-11-09,2026-11-13,2026-03-31,A,A*,Eng nufuzli,true,https://ieeevis.org/year/2026/welcome,manual:intl:2026:ieee-vis
International Conference on Research on Development in Information Retrieval,SIGIR,international,Kompyuter fanlari,Database & Data Mining,Melbourne,Avstraliya,,2026-07-20,2026-07-24,2026-01-22,A,A*,Eng nufuzli,true,https://sigir2026.org/en-AU,manual:intl:2026:sigir
International Conference on Computer-Aided Verification,CAV,international,Kompyuter fanlari,Computer Architecture & High Performance Computing,Lisbon,Portugaliya,,2026-07-26,2026-07-29,2026-01-28,A,A*,Eng nufuzli,true,https://conferences.i-cav.org/2026/,manual:intl:2026:cav
International Joint Conference on Artificial Intelligence,IJCAI,international,Kompyuter fanlari,Artificial Intelligence,Bremen,Germaniya,,2026-08-15,2026-08-21,2026-01-19,A,A*,Eng nufuzli,true,https://2026.ijcai.org/,manual:intl:2026:ijcai
International Cryptology Conference,CRYPTO,international,Kompyuter fanlari,Information Security,Santa Barbara,AQSh,,2026-08-17,2026-08-20,2026-02-12,A,A*,Eng nufuzli,true,https://crypto.iacr.org/2026/,manual:intl:2026:crypto
International Conference on Very Large Data Bases,VLDB,international,Kompyuter fanlari,Database & Data Mining,Boston,AQSh,,2026-08-31,2026-09-04,2025-04-01,A,A*,Eng nufuzli,true,https://www.vldb.org/2026/,manual:intl:2026:vldb
International Conference on Automated Software Engineering,ASE,international,Kompyuter fanlari,Software Engineering,Munich,Germaniya,,2026-10-12,2026-10-16,2026-03-26,A,A*,Eng nufuzli,true,https://conf.researchr.org/home/ase-2026,manual:intl:2026:ase
IEEE International Conference on Data Mining,ICDM,international,Kompyuter fanlari,Database & Data Mining,Shenyang,Xitoy,IEEE,2026-11-12,2026-11-15,2026-06-06,B,A*,Eng nufuzli,true,http://icdm2026.neu.edu.cn/,manual:intl:2026:icdm
Conference on Neural Information Processing Systems,NeurIPS,international,Kompyuter fanlari,Artificial Intelligence,Sydney,Avstraliya,,2026-12-06,2026-12-06,2026-05-07,A,A*,Eng nufuzli,true,https://neurips.cc/Conferences/2026,manual:intl:2026:neurips
Design Automation Conference,DAC,international,Kompyuter fanlari,Computer Science Theory,Long Beach,AQSh,,2026-07-26,2026-07-29,2025-11-18,A,A*,Eng nufuzli,true,https://dac.com/2026/call-for-contributions,manual:intl:2026:dac
IEEE Computer Security Foundations Workshop,CSFW,international,Kompyuter fanlari,Information Security,Lisbon,Portugaliya,IEEE,2026-07-26,2026-07-29,2025-07-24,B,A*,Eng nufuzli,true,https://csf2026.ieee-security.org/,manual:intl:2026:csfw
ACM Conference on Recommender Systems,RecSys,international,Kompyuter fanlari,Database & Data Mining,Minneapolis,AQSh,ACM,2026-09-28,2026-10-02,2026-04-21,B,A*,Eng nufuzli,true,https://recsys.acm.org/recsys26,manual:intl:2026:recsys
"Conference on Object-Oriented Programming Systems, Languages, and Applications",OOPSLA,international,Kompyuter fanlari,Software Engineering,Oakland,AQSh,,2026-10-03,2026-10-09,2025-10-10,A,A*,Eng nufuzli,true,https://conf.researchr.org/track/splash-2026/oopsla-2026,manual:intl:2026:oopsla
ACM Internet Measurement Conference,IMC,international,Kompyuter fanlari,Computer Networks,Karlsruhe,Germaniya,ACM,2026-11-03,2026-11-06,2025-11-20,B,A*,Eng nufuzli,true,https://conferences.sigcomm.org/imc/2026/,manual:intl:2026:imc
IEEE/ACM International Conference on Computer-Aided Design,ICCAD,international,Kompyuter fanlari,Computer Science Theory,San Jose,AQSh,IEEE,2026-11-08,2026-11-12,2026-04-14,B,A*,Eng nufuzli,true,https://iccad.com/2026,manual:intl:2026:iccad
"International Conference for High Performance Computing, Networking, Storage, and Analysis",SC,international,Kompyuter fanlari,Computer Science Theory,McCormick Place,AQSh,,2026-11-15,2026-11-20,2026-04-08,A,A*,Eng nufuzli,true,https://sc26.supercomputing.org/,manual:intl:2026:sc
International Conference on Principles of Knowledge Representation and Reasoning,KR,international,Kompyuter fanlari,Artificial Intelligence,Lisbon,Portugaliya,,2026-07-20,2026-07-23,2026-02-13,B,A*,Eng nufuzli,true,https://kr.org/KR2026/,manual:intl:2026:kr
European Conference on Computer Vision,ECCV,international,Kompyuter fanlari,Artificial Intelligence,Malmö,Shveciya,,2026-09-08,2026-09-13,2026-03-05,B,A*,Eng nufuzli,true,https://eccv.ecva.net/,manual:intl:2026:eccv
International Symposium on Mixed and Augmented Reality,ISMAR,international,Kompyuter fanlari,Computer Graphics & Multimedia,Bari,Italiya,,2026-10-05,2026-10-09,2026-03-16,B,A*,Eng nufuzli,true,https://www.ieeeismar.net/2026/,manual:intl:2026:ismar
The annual Conference on Empirical Methods in Natural Language Processing,EMNLP,international,Kompyuter fanlari,Artificial Intelligence,Budapest,Vengriya,,2026-10-24,2026-10-29,2026-05-25,B,A*,Eng nufuzli,true,https://2026.emnlp.org/,manual:intl:2026:emnlp
International Conference on Principles and Practice of Constraint Programming,CP,international,Kompyuter fanlari,Software Engineering,Lisbon,Portugaliya,,2026-07-20,2026-07-23,,B,A*,Eng nufuzli,true,https://cp2026.a4cp.org/,manual:intl:2026:cp
Conference on Uncertainty in Artificial Intelligence,UAI,international,Kompyuter fanlari,Artificial Intelligence,Amsterdam,Niderlandiya,,2026-08-17,2026-08-21,2026-02-25,B,A*,Eng nufuzli,true,https://www.auai.org/uai2026/,manual:intl:2026:uai
International Conference on Function Programming,ICFP,international,Kompyuter fanlari,Software Engineering,Indianapolis,AQSh,,2026-08-24,2026-08-29,2026-02-19,B,A*,Eng nufuzli,true,https://icfp26.sigplan.org/,manual:intl:2026:icfp
International Conference on Parallel Problem Solving From Nature,PPSN,international,Kompyuter fanlari,Artificial Intelligence,Trento,Italiya,,2026-08-29,2026-09-02,2026-03-28,B,A*,Eng nufuzli,true,https://ppsn2026.disi.unitn.it/,manual:intl:2026:ppsn
European Symposium on Research in Computer Security,ESORICS,international,Kompyuter fanlari,Information Security,Rome,Italiya,,2026-09-01,2026-09-01,2026-01-09,B,A*,Eng nufuzli,true,https://sites.google.com/di.uniroma1.it/esorics2026/home,manual:intl:2026:esorics
European Conference on Machine Learning and 25th Principles and Practice of Knowledge Discovery in Databases,ECML-PKDD,international,Kompyuter fanlari,Database & Data Mining,Naples,Italiya,,2026-09-07,2026-09-11,2026-03-12,B,A*,Eng nufuzli,true,https://ecmlpkdd.org/2026/,manual:intl:2026:ecml-pkdd
International Conference on Software Maintenance and Evolution,ICSME,international,Kompyuter fanlari,Software Engineering,Benevento,Italiya,,2026-09-14,2026-09-18,2026-03-06,B,A*,Eng nufuzli,true,https://conf.researchr.org/home/icsme-2026,manual:intl:2026:icsme
IEEE/RSJ International Conference on Intelligent Robots and Systems,IROS,international,Kompyuter fanlari,Artificial Intelligence,Pittsburgh,AQSh,IEEE,2026-09-27,2026-10-01,2026-03-02,C,A*,Eng nufuzli,true,https://2026.ieee-iros.org/,manual:intl:2026:iros
International Conference on Medical Image Computing and Computer Assisted Intervention,MICCAI,international,Kompyuter fanlari,Interdisciplinary & Mixed,Centre,U.A.E.,,2026-10-04,2026-10-08,2026-02-26,B,A*,Eng nufuzli,true,https://conferences.miccai.org/2026/en/IMPORTANT-DATES.html,manual:intl:2026:miccai
International Symposium on Empirical Software Engineering and Measurement,ESEM,international,Kompyuter fanlari,Software Engineering,München,Germaniya,,2026-10-04,2026-10-09,,B,A*,Eng nufuzli,true,https://conf.researchr.org/home/eseiw-2026,manual:intl:2026:esem
ACM International Joint Conference on Pervasive and Ubiquitous Computing,/ISWC,international,Kompyuter fanlari,Human-Computer Interaction,Shanghai,Xitoy,ACM,2026-10-11,2026-10-15,2026-02-01,A,C,Eng nufuzli,true,https://www.ubicomp.org/ubicomp-iswc-2026,manual:intl:2026:/iswc
International Symposium on Recent Advances in Intrusion Detection,RAID,international,Kompyuter fanlari,Information Security,Lancaster,Buyuk Britaniya,,2026-10-11,2026-10-14,2026-04-16,B,A*,Eng nufuzli,true,https://raid2026.org/,manual:intl:2026:raid
International Conference on Cryptographic Hardware and Embedded Systems,CHES,international,Kompyuter fanlari,Information Security,Türkiye,Türkiye,,2026-10-11,2026-10-15,2025-07-15,B,A*,Eng nufuzli,true,https://ches.iacr.org/2026/,manual:intl:2026:ches
International Semantic Web Conference,ISWC,international,Kompyuter fanlari,Database & Data Mining,Bari,Italiya,,2026-10-25,2026-10-29,2026-05-07,B,A*,Eng nufuzli,true,https://iswc2026.semanticweb.org/,manual:intl:2026:iswc
International Conference on Emerging Networking Experiments and Technologies,CoNEXT,international,Kompyuter fanlari,Computer Networks,Utrecht,Niderlandiya,,2026-12-07,2026-12-10,2025-12-12,B,A*,Eng nufuzli,true,https://conferences.sigcomm.org/co-next/2026/,manual:intl:2026:conext
Privacy Enhancing Technologies Symposium,PETS,international,Kompyuter fanlari,Information Security,Calgary,Kanada,,2026-07-20,2026-07-25,2025-05-31,C,A*,Eng nufuzli,true,https://petsymposium.org/cfp26.php,manual:intl:2026:pets
International Conference on Document Analysis and Recognition,ICDAR,international,Kompyuter fanlari,Artificial Intelligence,Vienna,Avstriya,,2026-08-30,2026-09-04,2026-02-27,C,A*,Eng nufuzli,true,https://icdar2026.org/,manual:intl:2026:icdar
Conference of the International Speech Communication Association,InterSpeech,international,Kompyuter fanlari,Computer Graphics & Multimedia,Sydney,Avstraliya,,2026-09-27,2026-10-01,2026-02-25,C,A*,Eng nufuzli,true,https://interspeech2026.org/,manual:intl:2026:interspeech
"International Conference on Modeling, Analysis and Simulation of Wireless and Mobile Systems",MSWiM,international,Kompyuter fanlari,Computer Networks,Paris,Fransiya,,2026-10-26,2026-10-30,2026-06-01,C,A*,Eng nufuzli,true,https://mswimconf.com/2026/,manual:intl:2026:mswim
British Machine Vision Conference,BMVC,international,Kompyuter fanlari,Artificial Intelligence,Lancaster,Buyuk Britaniya,,2026-11-23,2026-11-26,,C,A*,Eng nufuzli,true,https://bmvc2026.bmva.org/,manual:intl:2026:bmvc
IEEE International Conference on Network Protocols,ICNP,international,Kompyuter fanlari,Computer Networks,Tempe,AQSh,IEEE,2026-10-05,2026-10-08,2026-05-22,B,B,Yuqori nufuzli,true,https://icnp26.cs.ucr.edu/,manual:intl:2026:icnp
Annual Meeting of the Cognitive Science Society,CogSci,international,Kompyuter fanlari,Interdisciplinary & Mixed,Rio de Janeiro,Braziliya,,2026-07-22,2026-07-25,2026-02-02,B,B,Yuqori nufuzli,true,https://cognitivesciencesociety.org/cogsci-2026/,manual:intl:2026:cogsci
IEEE International Conference on Computer Communications and Networks,ICCCN,international,Kompyuter fanlari,Computer Networks,Honolulu,AQSh,IEEE,2026-07-27,2026-07-30,2026-02-13,C,B,Yuqori nufuzli,true,http://www.icccn.org/ICCCN26/,manual:intl:2026:icccn
European Conference on Parallel and Distributed Computing,Euro-Par,international,Kompyuter fanlari,Computer Science Theory,Pisa,Italiya,,2026-08-24,2026-08-28,2026-03-06,B,B,Yuqori nufuzli,true,https://2026.euro-par.org/,manual:intl:2026:euro-par
International Joint Conference on Biometrics,IJCB,international,Kompyuter fanlari,Artificial Intelligence,Rome,Italiya,IEEE,2026-09-01,2026-09-04,2026-04-10,C,B,Yuqori nufuzli,true,https://ijcb2026.ieee-biometrics.org/,manual:intl:2026:ijcb
The IEEE International Conference on Image Processing,ICIP,international,Kompyuter fanlari,Computer Graphics & Multimedia,Tampere,Finlandiya,IEEE,2026-09-13,2026-09-17,2026-02-04,C,B,Yuqori nufuzli,true,https://2026.ieeeicip.org/,manual:intl:2026:icip
International Conference on Parallel Processing,ICPP,international,Kompyuter fanlari,Computer Science Theory,Singapore,Singapur,,2026-09-28,2026-10-01,2026-05-01,B,B,Yuqori nufuzli,true,https://icpp2026.github.io/,manual:intl:2026:icpp
"IEEE International Conference on Systems, Man, and Cybernetics",SMC,international,Kompyuter fanlari,Interdisciplinary & Mixed,Bellevue,AQSh,IEEE,2026-10-04,2026-10-07,2026-03-22,C,B,Yuqori nufuzli,true,https://www.ieeesmc2026.org/,manual:intl:2026:smc
ACM International Conference on Multimodal Interaction,ICMI,international,Kompyuter fanlari,Human-Computer Interaction,Napoli,Italiya,ACM,2026-10-05,2026-10-09,2026-04-20,C,B,Yuqori nufuzli,true,https://icmi.acm.org/2026/,manual:intl:2026:icmi
IEEE Conference on Local Computer Networks,LCN,international,Kompyuter fanlari,Computer Networks,Coimbra,Portugaliya,IEEE,2026-10-07,2026-10-09,2026-04-20,C,B,Yuqori nufuzli,true,https://www.ieeelcn.org/,manual:intl:2026:lcn
"IEEE International Conference on Trust, Security and Privacy in Computing and Communications",TrustCom,international,Kompyuter fanlari,Information Security,Hong Kong SAR,Xitoy,IEEE,2026-11-14,2026-11-15,2026-05-01,C,B,Yuqori nufuzli,true,https://collaboratecom.eai-conferences.org/2026/,manual:intl:2026:trustcom
ACM SIGGRAPH Annual Conference in Asia,ACM SIGGRAPH ASIA,international,Kompyuter fanlari,Computer Graphics & Multimedia,KLCC,Malayziya,ACM,2026-12-01,2026-12-04,2025-05-12,A,N,Eng nufuzli,true,https://asia.siggraph.org/2026/,manual:intl:2026:acm-siggraph-asia
IEEE Global Communications Conference,GLOBECOM,international,Kompyuter fanlari,Computer Networks,Macao,Xitoy,IEEE,2026-12-07,2026-12-11,2026-04-01,C,B,Yuqori nufuzli,true,https://globecom2026.ieee-globecom.org/,manual:intl:2026:globecom
IEEE International Symposium on Software Reliability Engineering (ISSRE),ISSRE,international,Kompyuter fanlari,computer science,Limassol,Kipr,IEEE,2026-10-20,2026-10-20,,,A*,Eng nufuzli,true,https://conferenceindex.org/event/ieee-international-symposium-on-software-reliability-engineering-issre-2026-october-limassol-cy,manual:intl:2026:issre
International Conference on Case-Based Reasoning,ICCBR,international,Kompyuter fanlari,Artificial Intelligence,Bremen,Germaniya,,2026-08-13,2026-08-16,2026-03-20,B,C,Yuqori nufuzli,true,https://2026.iccbr.org/,manual:intl:2026:iccbr
International Conference on Pattern Recognition,ICPR,international,Kompyuter fanlari,Artificial Intelligence,Lyon,Fransiya,,2026-08-17,2026-08-21,2025-12-20,C,B,Yuqori nufuzli,true,https://icpr2026.org/,manual:intl:2026:icpr
Symposium On Usable Privacy and Security,SOUPS,international,Kompyuter fanlari,Information Security,Hannover,Germaniya,,2026-08-23,2026-08-26,2026-02-12,C,B,Yuqori nufuzli,true,https://soups.page/,manual:intl:2026:soups
Selected Areas in Cryptography,SAC,international,Kompyuter fanlari,Information Security,Ottawa,Kanada,,2026-08-24,2026-08-28,2026-02-02,C,B,Yuqori nufuzli,true,https://sacworkshop.org/SAC26/,manual:intl:2026:sac
The Conference on Robot Learning,CoRL,international,Kompyuter fanlari,Artificial Intelligence,Austin,AQSh,,2026-11-10,2026-11-12,2026-05-28,N,A*,Eng nufuzli,true,https://www.corl.org/,manual:intl:2026:corl
Pacific Rim International Conference on Artificial Intelligence,PRICAI,international,Kompyuter fanlari,Artificial Intelligence,Guangzhou,Xitoy,,2026-11-17,2026-11-20,2026-06-13,C,B,Yuqori nufuzli,true,https://2026.pricai.org/,manual:intl:2026:pricai
Asian Conference on Computer Vision,ACCV,international,Kompyuter fanlari,Artificial Intelligence,Osaka,Yaponiya,,2026-12-14,2026-12-18,2026-07-05,C,B,Yuqori nufuzli,true,https://accv2026.org/,manual:intl:2026:accv
"International Conference on Knowledge Science, Engineering and Management",KSEM,international,Kompyuter fanlari,Artificial Intelligence,Beijing,Xitoy,,2026-07-17,2026-07-19,2026-01-15,C,C,Yuqori nufuzli,true,https://ksem2026.rosc.org.cn/,manual:intl:2026:ksem
International Conference on Security and Privacy in Communication Networks,SecureComm,international,Kompyuter fanlari,Information Security,Lancaster,UK and hybrid,,2026-07-21,2026-07-24,2025-12-15,C,C,Yuqori nufuzli,true,https://securecomm.eai-conferences.org/2026/,manual:intl:2026:securecomm
International Conference on Intelligent Computing,ICIC,international,Kompyuter fanlari,Interdisciplinary & Mixed,Toronto,Kanada,,2026-07-22,2026-07-26,2026-03-20,C,C,Yuqori nufuzli,true,http://www.ic-icc.cn/2026/,manual:intl:2026:icic
International Conference on Digital Forensics & Cyber Crime,ICDF2C,international,Kompyuter fanlari,Information Security,Reykjavik,Islandiya,,2026-09-08,2026-09-10,2026-01-20,C,C,Yuqori nufuzli,true,https://icdf2c.eai-conferences.org/2026/,manual:intl:2026:icdf2c
International Conference on Information and Communications Security,ICICS,international,Kompyuter fanlari,Information Security,Fukui,Yaponiya,,2026-10-27,2026-10-30,2026-02-28,C,C,Yuqori nufuzli,true,https://sulab-sever.u-aizu.ac.jp/icics2026/cfp.html,manual:intl:2026:icics
The International Conference on Advanced Data Mining and Applications,ADMA,international,Kompyuter fanlari,Database & Data Mining,Hong Kong,Xitoy,,2026-11-01,2026-11-03,,C,C,Yuqori nufuzli,true,https://adma2026.github.io/,manual:intl:2026:adma
"International Conference on Collaborative Computing: Networking, Applications and Worksharing",CollaborateCom,international,Kompyuter fanlari,Human-Computer Interaction,Hong Kong SAR,Xitoy,,2026-11-14,2026-11-15,2026-05-01,C,C,Yuqori nufuzli,true,https://collaboratecom.eai-conferences.org/2026/,manual:intl:2026:collaboratecom
27th International Web Information Systems Engineering conference,WISE,international,Kompyuter fanlari,information systems,Venice,Italiya,IEEE,2026-11-02,2026-11-06,2026-06-17,,B,Yuqori nufuzli,true,http://www.wikicfp.com/cfp/servlet/event.showcfp?eventid=192125&copyownerid=3208,manual:intl:2026:wise
"IEEE International Conference on Application-Specific Systems, Architectures, and Processors",ASAP,international,Kompyuter fanlari,Computer Science Theory,London,Buyuk Britaniya,IEEE,2026-09-03,2026-09-04,2026-04-03,C,N,Yuqori nufuzli,true,https://2026.asap-conf.org/,manual:intl:2026:asap
International Conference on Advanced Learning Technologies (ICALT),ICALT,international,Taʼlim,education,Paris,Fransiya,,2026-07-19,2026-07-19,,,B,Yuqori nufuzli,true,https://conferenceindex.org/event/international-conference-on-advanced-learning-technologies-icalt-2026-july-paris-fr,manual:intl:2026:icalt
The 27th Meeting of the Special Interest Group on Discourse and Dialogue,SIGDIAL,international,Kompyuter fanlari,natural language processing,Atlanta,AQSh,,2026-08-03,2026-08-05,2026-04-20,,B,Yuqori nufuzli,true,http://www.wikicfp.com/cfp/servlet/event.showcfp?eventid=192460&copyownerid=197283,manual:intl:2026:sigdial
The 37th International Conference on Database and Expert Systems Applications - DEXA2026,DEXA,international,Kompyuter fanlari,big data,Graz,Avstriya,IEEE,2026-08-11,2026-08-13,2026-03-15,,C,Yuqori nufuzli,true,http://www.wikicfp.com/cfp/servlet/event.showcfp?eventid=191860&copyownerid=175531,manual:intl:2026:dexa
International Joint Conference on Rules and Reasoning,RuleML+RR,international,Kompyuter fanlari,Artificial Intelligence,Vilnius,Litva,,2026-08-24,2026-08-26,2026-05-15,N,B,Yuqori nufuzli,true,https://2026.declarativeai.net/events/ruleml-rr,manual:intl:2026:ruleml+rr
30th European Conference on Advances in Databases and Information Systems,ADBIS,international,Kompyuter fanlari,information systems,OrlÃ©ans,Fransiya,IEEE,2026-09-28,2026-10-01,2026-04-21,,C,Yuqori nufuzli,true,http://www.wikicfp.com/cfp/servlet/event.showcfp?eventid=192542&copyownerid=197340,manual:intl:2026:adbis
IEEE Frontiers in Education Conference,FIE,international,Taʼlim,education,Hotel,Kipr,IEEE,2026-10-11,2026-10-14,2026-03-13,,C,Yuqori nufuzli,true,http://www.wikicfp.com/cfp/servlet/event.showcfp?eventid=191503&copyownerid=49757,manual:intl:2026:fie
Advanced Concepts for Intelligent Vision Systems,ACIVS,international,Tibbiyot va salomatlik,medical imaging,Okinawa,Okinawa,,2026-12-15,2026-12-17,2026-06-01,,B,Yuqori nufuzli,true,http://www.wikicfp.com/cfp/servlet/event.showcfp?eventid=192245&copyownerid=197160,manual:intl:2026:acivs
Asia-Pacific Symposium on Internetware,Internetware,international,Kompyuter fanlari,Software Engineering,Gold Coast,Avstraliya,,2026-07-18,2026-07-20,2026-04-04,C,N,Yuqori nufuzli,true,https://conf.researchr.org/home/internetware-2026,manual:intl:2026:internetware
Asia-Pacific Workshop on Networking,APNet,international,Kompyuter fanlari,Computer Networks,Osaka,Yaponiya,,2026-08-06,2026-08-07,2026-03-06,C,N,Yuqori nufuzli,true,https://conferences.sigcomm.org/events/apnet2026/,manual:intl:2026:apnet
Springer -- The 10th International Conference on Economic Management and Green Development,ICEMGD,international,Iqtisodiyot va biznes,finance,,,Springer,2026-03-02,2026-09-28,2026-09-21,,,Yuqori nufuzli,true,http://www.wikicfp.com/cfp/servlet/event.showcfp?eventid=192716&copyownerid=197426,manual:intl:2026:icemgd
Springer--11th International Conference on Civil Engineering and Materials Science,ICCEMS,international,Muhandislik,civil engineering,Kuala Lumpur,Malayziya,Springer,2026-07-15,2026-07-19,2026-04-05,,,Yuqori nufuzli,true,http://www.wikicfp.com/cfp/servlet/event.showcfp?eventid=189549&copyownerid=13881,manual:intl:2026:iccems
the 9th International Conference on Nanoscience and Technology,ICNST,international,Tabiiy fanlar,nanotechnology,Kuala Lumpur,Malayziya,IEEE,2026-07-15,2026-07-19,2026-04-05,,,Yuqori nufuzli,true,http://www.wikicfp.com/cfp/servlet/event.showcfp?eventid=189550&copyownerid=13881,manual:intl:2026:icnst
"15th International Conference on Environment, Energy and Biotechnology",ICEEB,international,Muhandislik,energy,Seoul,Janubiy Koreya,Springer,2026-07-17,2026-07-19,2026-03-25,,,Yuqori nufuzli,true,http://www.wikicfp.com/cfp/servlet/event.showcfp?eventid=190445&copyownerid=13881,manual:intl:2026:iceeb
The 5th International Conference on Intelligent Science and Technology,ICIST--EI,international,Muhandislik,robotics,Nanjing,Xitoy,IEEE,2026-07-17,2026-07-19,2026-03-25,,,Yuqori nufuzli,true,http://www.wikicfp.com/cfp/servlet/event.showcfp?eventid=188640&copyownerid=13881,manual:intl:2026:icist--ei
The 9th International Conference on Machine Learning and Machine Intelligence,ACM MLMI,international,Muhandislik,automation,Tokyo,Yaponiya,IEEE,2026-07-17,2026-07-20,2026-03-25,,,Yuqori nufuzli,true,http://www.wikicfp.com/cfp/servlet/event.showcfp?eventid=191461&copyownerid=13881,manual:intl:2026:acm-mlmi
The 10th International Conference on Deep Learning Technologies,ICDLT,international,Kompyuter fanlari,deep learning,Kunming,Xitoy,IEEE,2026-07-17,2026-07-19,2026-04-10,,,Yuqori nufuzli,true,http://www.wikicfp.com/cfp/servlet/event.showcfp?eventid=190990&copyownerid=13881,manual:intl:2026:icdlt
