old_name,new_name,diss_count,rule
Наманган давлат универдитети,Наманган давлат университети,1,typo
Наманган давлат универсттети,Наманган давлат университети,1,typo
"Наманган муҳандислик-технология институти, Умумий ва ноорганик кимё институти",Наманган муҳандислик-технология институти,19,exact-fold
Наманган муҳандислик технология институти,Наманган муҳандислик-технология институти,13,exact-fold
Наманган мухандислик-технология институти,Наманган муҳандислик-технология институти,5,curated-group
Наманган муҳандислик-технология иститути,Наманган муҳандислик-технология институти,5,typo
Наманган муҳандислик - технология институти,Наманган муҳандислик-технология институти,2,exact-fold
"Наманган муҳандислик-технология институти, Ўзбекистон миллий университети",Наманган муҳандислик-технология институти,2,exact-fold
Наманган муҳандислик–технология институти,Наманган муҳандислик-технология институти,2,exact-fold
Наманган муҳандислик -технология институти,Наманган муҳандислик-технология институти,1,exact-fold
"Наманган муҳандислик технология институти, Наманган муҳандислик қурилиш институти",Наманган муҳандислик-технология институти,1,exact-fold
"Наманган муҳандислик технология институти, Тошкент кимё-технология институти Шаҳрисабз филиали",Наманган муҳандислик-технология институти,1,exact-fold
Наманган муҳандислик-технология институти ва Фарғона давлат университети,Наманган муҳандислик-технология институти,1,exact-fold
Наманган муҳандислик-технология институти ва Наманган муҳандислик-қурилиш институти,Наманган муҳандислик-технология институти,1,exact-fold
"Наманган муҳандислик-технология институти, Наманган муҳандислик-қурилиш институти",Наманган муҳандислик-технология институти,1,exact-fold
"Наманган муҳандислик-технология институти, Ўсимлик моддалари кимёси институти",Наманган муҳандислик-технология институти,1,exact-fold
"Наманган муҳандислик-технология институти, Қўқон давлат педагогика институти",Наманган муҳандислик-технология институти,1,exact-fold
"Наманган муҳандислик-технология институти, Тошкент давлат аграр университети",Наманган муҳандислик-технология институти,1,exact-fold
"Наманган муҳандислик-технология институти, Тошкент фармацевтика институти",Наманган муҳандислик-технология институти,1,exact-fold
"Наманган муҳандислик-технология институти, Тошкент кимё-технология",Наманган муҳандислик-технология институти,1,exact-fold
"Наманган муҳандислик-технология институти, Тошкент кимё-технология институти",Наманган муҳандислик-технология институти,1,exact-fold
"Наманган муҳандислик-технология институти, Тошкент тўқимачилик ва енгил саноат институти",Наманган муҳандислик-технология институти,1,exact-fold
“Наманган муҳандислик-технология институти”,Наманган муҳандислик-технология институти,1,exact-fold
Наманган мухандислик технология институти ва Россия миллий таддқиқотлар технология университети МИСИС Олмалиқ филиали,Наманган муҳандислик-технология институти,1,curated-group
Наманган муҳандислик-техналогия институти,Наманган муҳандислик-технология институти,1,typo
Наманган муҳандислик-технология институт,Наманган муҳандислик-технология институти,1,typo
Наманган муҳандистлик технология институти,Наманган муҳандислик-технология институти,1,typo
Наманган мухандислик техналогия иниститути,Наманган муҳандислик-технология институти,1,typo
Наманган мухандислик технология нститути,Наманган муҳандислик-технология институти,1,typo
Наманган муҳандислик қурилиш институти,Наманган муҳандислик-қурилиш институти,2,exact-fold
Наманган муҳандислик – қурилиш институти,Наманган муҳандислик-қурилиш институти,1,exact-fold
Наманган муҳандислик-қурилиш институти ва Муҳаммад Ал-Хоразмий номидаги Тошкент ахборот технологиялари университети,Наманган муҳандислик-қурилиш институти,1,exact-fold
Наманган муҳандислик-қурилиш институтида,Наманган муҳандислик-қурилиш институти,1,exact-fold
Наманган муҳандислик-қурилиш институтида бажарилган,Наманган муҳандислик-қурилиш институти,1,exact-fold
Наманган мухандислик қурилиш институти,Наманган муҳандислик-қурилиш институти,1,curated-group
Наманган мухандислик-қурилиш институти,Наманган муҳандислик-қурилиш институти,1,curated-group
Наманган муандислик–қурилиш институти,Наманган муҳандислик-қурилиш институти,1,typo
Наманган муҳадислик-қурилиш институти,Наманган муҳандислик-қурилиш институти,1,typo
Нефт ва газ конлари геологияси ҳамда қидируви институти,Нефть ва газ конлари геологияси ҳамда қидируви институти,1,exact-fold
Нефт ва газ конлари геологияси ҳамда қидируви институти ДМ,Нефть ва газ конлари геологияси ҳамда қидируви институти,1,curated-group
Нефть ва газ конлари геологияси ҳамда қидируви институти ДМ,Нефть ва газ конлари геологияси ҳамда қидируви институти,1,curated-group
Ниозомий номидаги Ўзбекистон миллий педагогика университети,Низомий номидаги Ўзбекистон миллий педагогика университети,1,typo
Нукус давлат педагогика инситути,Нукус давлат педагогика институти,2,typo
Нукус дaвлaт педагогика институти,Нукус давлат педагогика институти,1,exact-fold
Нукус давлат педагогика институти ва Ўзбекистон Миллий университети ҳузуридаги Яримўтказгичлар физикаси ва микроелектроника,Нукус давлат педагогика институти,1,exact-fold
Нукус давлат педагогика институти ва В.И.Романовский номидаги Математика институти,Нукус давлат педагогика институти,1,exact-fold
“Нукус давлат педагогика институти”,Нукус давлат педагогика институти,1,exact-fold
Нукус давлар педагогика институти,Нукус давлат педагогика институти,1,typo
Нукус давлат педагогика индтитути,Нукус давлат педагогика институти,1,typo
Нукус давлат педагогика институт,Нукус давлат педагогика институти,1,typo
Нукус давлат педагогика институтини,Нукус давлат педагогика институти,1,typo
Нукус давлат педагогика инстиути,Нукус давлат педагогика институти,1,typo
Нукус давлат педагогика интитути,Нукус давлат педагогика институти,1,typo
Нукус давлат педгогика институти,Нукус давлат педагогика институти,1,typo
Озиқ-овқат технологияси ва муҳандислиги халқаро институти,Озиқ овқат технологияси ва муҳандислиги халқаро институти,1,exact-fold
"Озиқ-овқат технологияси ва муҳандислиги халқаро институти, Умумий ва ноорганик кимё институти",Озиқ овқат технологияси ва муҳандислиги халқаро институти,1,exact-fold
Озиқ -овқат ва қишлоқ хўжалиги соҳасида стратегик ривожланиш ва тадқиқотлар халқаро маркази,Озиқ-овқат ва қишлоқ хўжалиги соҳасида стратегик ривожланиш ва тадқиқотлар халқаро маркази,1,exact-fold
Ориэнтал университети,Ориентал университети,1,exact-fold
"Пaxтa cелекцияcи, уруғчилиги вa етиштириш aгрoтеxнoлoгиялaри","Пахта селекцияси, уруғчилиги ва етиштириш агротехнологиялари",2,exact-fold
"Пaхтa селекцияси, уруғчилиги вa етиштириш aгрoтехнoлoгиялaри","Пахта селекцияси, уруғчилиги ва етиштириш агротехнологиялари",1,exact-fold
"Пахта селексияси, уруғчилиги ва йетиштириш агротехнологиялари","Пахта селекцияси, уруғчилиги ва етиштириш агротехнологиялари",1,typo
"Пахта селекцияси, уруғчилиги ва етиштириш агротехнологиялар","Пахта селекцияси, уруғчилиги ва етиштириш агротехнологиялари",1,typo
"Пахта селекцияси, уруғчилиги ва йетиштириш агротехнологиялари","Пахта селекцияси, уруғчилиги ва етиштириш агротехнологиялари",1,typo
Рақамли технологиялар ва сунʼий интеллектни ривожлантириш,Рақамли технологиялар ва сунъий интеллектни ривожлантириш,1,exact-fold
Рecпубликa мaънaвият вa мaърифaт мaркaзи,Республика Маънавият ва маърифат маркази,1,exact-fold
Республика Маънавият ва маърифат маркази ҳузуридаги Ижтимоий - маънавий тадқиқотлар институти,Республика Маънавият ва маърифат маркази ҳузуридаги Ижтимоий-маънавий тадқиқотлар институти,1,exact-fold
Республика дерматовенерология ва косметология ихтисослаштирилган,Республика ихтисослаштирилган дерматовенерология ва косметология,1,curated
Республика ихтисолаштирилган кардиология,Республика ихтисослаштирилган кардиология,2,typo
Рeспублика ихтисослаштирилган она ва бола саломатлиги,Республика ихтисослаштирилган она ва бола саломатлиги,1,exact-fold
«Республика ихтисослаштирилган онкология ва радиология,Республика ихтисослаштирилган онкология ва радиология,1,exact-fold
Республика ихтисослашган Педиатрия,Республика ихтисослаштирилган педиатрия,1,typo
"Сабзавот, полиз екинлари ва картошкачилик","Сабзавот, полиз экинлари ва картошкачилик",1,exact-fold
Самарқанд Агроинновaциялар ва тадқиқотлар институти,Самарқанд агроинновациялар ва тадқиқотлар институти,1,exact-fold
Самарқанд ветеринария медицинаси институти ва Қарши мухандислик-иқтисодиёт институтида,Самарқанд ветеринария медицинаси институти,1,exact-fold
"Самарқанд ветеринария медицинаси институти, Тошкент давлат иқтисодиёт университети Самарқанд филиали",Самарқанд ветеринария медицинаси институти,1,exact-fold
Самарқанд давлат арxитектура-қурилиш институти,Самарқанд давлат архитектура-қурилиш институти,2,exact-fold
“Самарқанд давлат архитектура-қурилиш институти”,Самарқанд давлат архитектура-қурилиш институти,2,exact-fold
“Самарқанд давлат архитектура қурилиш институти”,Самарқанд давлат архитектура-қурилиш институти,1,exact-fold
"“Самарқанд давлат архитектура-қурилиш институти”, “Тошкент архитектура-қурилиш институти”",Самарқанд давлат архитектура-қурилиш институти,1,exact-fold
Самарқанд давлат архитектура-қурилиш университетида,Самарқанд давлат архитектура-қурилиш университети,8,exact-fold
Самарқанд давлат архитектура қурилиш университети,Самарқанд давлат архитектура-қурилиш университети,1,exact-fold
"Самарқанд давлат ветеринария медитсинаси, чорвачилик ва биотехнологиялар университети","Самарқанд давлат ветеринария медицинаси, чорвачилик ва биотехнологиялар университети",16,exact-fold
"Cамарқанд давлат ветеринария медицинаси, чорвачилик ва биотехнологиялар университети","Самарқанд давлат ветеринария медицинаси, чорвачилик ва биотехнологиялар университети",6,exact-fold
"Самарқанд ветеринария медицинаси, чорвачилик ва биотехнологиялар университети","Самарқанд давлат ветеринария медицинаси, чорвачилик ва биотехнологиялар университети",2,curated-group
"Самарқанд давлат ветеринария медицинаси, чорвачилиги ва биотехнологиялар университети","Самарқанд давлат ветеринария медицинаси, чорвачилик ва биотехнологиялар университети",2,typo
"Самарқанд ветеринария медитсинаси, чорвачилик ва биотехнологиялар университети","Самарқанд давлат ветеринария медицинаси, чорвачилик ва биотехнологиялар университети",1,curated-group
"Самарқанд давлат ветеринария медисинаси, чорвачилик ва биотехнологиялар университети","Самарқанд давлат ветеринария медицинаси, чорвачилик ва биотехнологиялар университети",1,typo
"Самарқанд давлат ветеринария медитсинаси, чорвачилик ва биотехнологиялар университети Нукус филиали","Самарқанд давлат ветеринария медицинаси, чорвачилик ва биотехнологиялар университети Нукус филиали",2,exact-fold
"Самарқанд давлат ветеринария медицинаси, чорвачилик ва биотехнологиялар университетининг Тошкент филиали","Самарқанд давлат ветеринария медицинаси, чорвачилик ва биотехнологиялар университети Тошкент филиали",6,curated-group
"Самарқанд давлат ветеринария медитсинаси, чорвачилик ва биотехнологиялар университети Тошкент филиали","Самарқанд давлат ветеринария медицинаси, чорвачилик ва биотехнологиялар университети Тошкент филиали",2,exact-fold
"Самарқанд давлат ветеринария медитсинаси, чорвачилик ва биотехнологиялар университетининг Тошкент филиали","Самарқанд давлат ветеринария медицинаси, чорвачилик ва биотехнологиялар университети Тошкент филиали",1,curated-group
Самарқанд давлат педагогика институти (Ўзбекистон-Финландия педагогика институти),Самарқанд давлат педагогика институти,1,exact-fold
Самарканд давлат тиббиёт институти,Самарқанд давлат тиббиёт институти,12,curated-group
Самаркан давлат тиббиёт институти,Самарқанд давлат тиббиёт институти,2,typo
"Самарқанд давлат тиббиёт институти, Тошкент тиббиёт академияси",Самарқанд давлат тиббиёт институти,1,exact-fold
Самарқанд давлат тиббиёт институтида бажарилган,Самарқанд давлат тиббиёт институти,1,exact-fold
Самарканд давлат тиббиет институти,Самарқанд давлат тиббиёт институти,1,curated-group
Самарканд давлат тиббёт институти,Самарқанд давлат тиббиёт институти,1,typo
Самарканд давлат тиббиёт университети,Самарқанд давлат тиббиёт университети,80,curated-group
Самарқанд давлат тиббиёт тиббиёт университети,Самарқанд давлат тиббиёт университети,4,curated
Самарқанд давлат тиббиёт унивенрситети,Самарқанд давлат тиббиёт университети,3,typo
Самарканд давлат тиббиет университети,Самарқанд давлат тиббиёт университети,2,curated-group
Самрқанд давлат тиббиёт унверстети,Самарқанд давлат тиббиёт университети,2,typo
Самарқанд давлат тиббиет университети,Самарқанд давлат тиббиёт университети,1,exact-fold
"Самарқанд давлат тиббиёт университети, Республика ихтисослаштирилган эпидемиология, микробиология, юқумли ва паразитар касалликлар",Самарқанд давлат тиббиёт университети,1,exact-fold
Самарқанд тиббиёт университети,Самарқанд давлат тиббиёт университети,1,curated
Самарканд давлат тиббиёт универститети,Самарқанд давлат тиббиёт университети,1,typo
Самарқанд давлат тиббиёт универститети,Самарқанд давлат тиббиёт университети,1,typo
Самарқанд давлат тиббиёт унуверситети,Самарқанд давлат тиббиёт университети,1,typo
Самарқанд давлат тиббиёт унверситети,Самарқанд давлат тиббиёт университети,1,typo
Самартканд давлат тиббиёт университети,Самарқанд давлат тиббиёт университети,1,typo
Самақарқанд давлат университети,Самарқанд давлат университети,2,typo
Cамарқанд давлат университети,Самарқанд давлат университети,1,exact-fold
Самарқанд давлат унивeрситeти,Самарқанд давлат университети,1,exact-fold
Самарқанд давлат Университети ва В.И. Романовский номидаги математика институтида бажарилган,Самарқанд давлат университети,1,exact-fold
"Самарқанд давлат университети, Умумий ва ноорганик кимё институти",Самарқанд давлат университети,1,exact-fold
Самарқан давлат университети,Самарқанд давлат университети,1,typo
Самарқанд давлат универитети,Самарқанд давлат университети,1,typo
Самрқанд давлат университети,Самарқанд давлат университети,1,typo
Самарқанд давлат чет тиллари институти,Самарқанд давлат чет тиллар институти,9,curated
Самарқанд давлат чет тиллар институтида,Самарқанд давлат чет тиллар институти,2,exact-fold
Caмapқaнд дaвлaт чeт тиллap инcтитути,Самарқанд давлат чет тиллар институти,2,curated
Самарқанд давлат чет тиллар институте,Самарқанд давлат чет тиллар институти,2,typo
Самарқанд дaвлaт чет тиллар институти,Самарқанд давлат чет тиллар институти,1,exact-fold
Самарқанд давлат чет тиллар институти(СамДЧТИ),Самарқанд давлат чет тиллар институти,1,exact-fold
Самарқанд давлат чет тиллар,Самарқанд давлат чет тиллар институти,1,curated
